{
  "schema_version": "rank-result.v1",
  "rank_id": "rank-demo-001",
  "observation_id": "obs-demo-001",
  "score": 0.82,
  "rank_version": "rank-v1.0.0",
  "ranked_at": "2026-09-11T03:30:00Z",
  "reasons": [
    {
      "code": "discount_depth",
      "message": "Mức giảm 25% so với list price.",
      "weight": 0.4
    },
    {
      "code": "freshness",
      "message": "Observation trong vòng 1 giờ.",
      "weight": 0.3
    }
  ],
  "features": {
    "discount_ratio": 0.25,
    "age_seconds": 1800,
    "stock_status": "in_stock"
  }
}
